{
  "schema_version": "0.9.0",
  "campaign_id": "example-synthetic-prbs",
  "title": "SYNTHETIC EXAMPLE -- not a real study",
  "description": "Can the synthetic PRBS trace determine the two-site model's constants? Exists to exercise the schema.",
  "status": "active",
  "milestone": "baseline-reproduction",
  "spokes": [
    "tcat-data-standard (examples)",
    "tcat-tool-standard"
  ],
  "artifacts": [
    {
      "ref": "prbs-co-ox-synthetic-001",
      "kind": "dataset",
      "role": "measured campaign"
    },
    {
      "ref": "model-lh-two-site-synthetic-2026-09-01-fa1957",
      "kind": "model",
      "role": "baseline fit"
    },
    {
      "ref": "SYNTH-CATALYST-001",
      "kind": "sample",
      "role": "catalyst"
    },
    {
      "ref": "10.5281/zenodo.0000000",
      "kind": "external",
      "role": "reference dataset",
      "notes": "External members are named, never implied."
    }
  ],
  "notes": "SYNTHETIC. Every id here points at the sibling examples."
}
